[
  {
    "pair": 1,
    "speaker": "user",
    "text": "File: FlashBoards_Creative_AI_Canvas.png\n\nThis image I want to like animate in Cling 3.0 Pro. So like this jellyfish kind of thing, like moving upwards, like jellyfish movement, and I don't need much camera movement, so I won't animate it, so give me a prompt for Cling 3.0 based on all your knowledge about how to prompt for this. Give me a prompt for Cling that would make it work in the best way, not in a bad way, please.\n\nanlayze the image and understand the best way to get this result please base don the images dynamics",
    "attachments": [],
    "ts": "2026-04-25T08:11:21Z"
  },
  {
    "pair": 1,
    "speaker": "ai",
    "text": "I'll analyze the image first to understand its dynamics, then craft an optimal Kling 3.0 Pro prompt based on the project's prompting manual.\n\nViewed file\n\nAnalyzing the jellyfish image to understand its visual dynamics for animation\n\nDone\n\nGot it. Now let me check the Kling 3.0 manual to make sure I'm following the recommended structure for this kind of subtle organic motion shot.\n\nViewed file\n\nReading the Kling prompting manual for best practices\n\nDone\n\nI have what I need from the Kling manual. Now I have a clear picture of the image dynamics and the right approach.\n\nWhat I'm seeing in your image:\n\n4 illuminated jellyfish sculptures suspended above a reflective water surface in an ancient cistern (looks like Istanbul's Basilica Cistern)\n\nMassive stone columns, warm amber stone lighting, glowing teal-blue jellyfish bells\n\nTrailing tentacles hanging straight down with mirror reflections in still water\n\nThe image is a static installation — you want to bring it to life with that pulsing, breathing jellyfish rhythm\n\nKey Kling principles for your shot:\n\nOne-motion rule — single focused action, no multi-stage choreography\n\nNo camera movement as you specified — this lets all motion budget go into the subject\n\nLayered prompt: subject motion → secondary motion → ambient → negative prompt\n\nUse specific action verbs, avoid vague \"moving\"\n\nHere's your prompt:\n\n🎬 KLING 3.0 PRO — Image-to-Video Prompt\n\nMode: Professional | Duration: 5s | Aspect: 16:9 | CFG: 0.5\n\nMain Prompt\n\nThe bell-shaped jellyfish bodies pulse gently and rhythmically, contracting and expanding in slow organic breathing motion as they drift slightly upward. Long delicate tentacles trail downward, swaying and undulating softly like seaweed in a slow current. The teal-blue bioluminescence flickers and shimmers across the translucent bells. Faint ripples spread across the still water surface below, distorting the reflections. Ambient warm light on the stone columns stays steady. Static camera, no camera movement, locked tripod shot.\n\nNegative Prompt\n\ncamera movement, camera pan, zoom, dolly, shaky cam, fast motion, jerky motion, morphing, distorted shapes, melting, jellyfish swimming sideways, jellyfish leaving frame, columns moving, walls moving, scene changes, rapid pulsing, strobe effect, color shift, blurry, low quality, artifacts, deformed\n\nWhy this works\n\nSubject motion is layered in priority order — pulse first (primary), tentacle sway second (secondary), bioluminescence shimmer third (tertiary), water ripples fourth (ambient). Kling allocates motion budget top-down, so the most important action goes first.\n\n\"Drift slightly upward\" gives you the gentle rising jellyfish feel without making them fly out of frame in 5 seconds — Kling tends to over-execute directional cues, so \"slightly\" is the safety word.\n\n\"Slow organic breathing motion\" + \"slow current\" are the two phrases that consistently produce that hypnotic real-jellyfish rhythm rather than the frantic CGI flutter Kling defaults to.\n\nHeavy negative prompt on camera — locking the camera takes three separate cues because Kling 3.0 Pro will sneak in a slow push-in by default if you don't fence it off explicitly.\n\nCFG 0.5 (lower than default 0.7) — gives the model creative freedom on the organic flow physics while the negatives keep it on rails. Higher CFG tends to produce stiffer, less natural pulsing on creature shots.\n\nOne iteration tip\n\nRun it twice. First gen at these settings, and if the pulse is too subtle, change \"pulse gently and rhythmically\" → \"pulse visibly with clear contraction and release\". If it's too aggressive, change to \"breathe slowly with subtle contraction\". That single phrase is the dial.",
    "attachments": [],
    "ts": "2026-04-25T08:12:16Z"
  },
  {
    "pair": 2,
    "speaker": "user",
    "text": "File: FlashBoards_Creative_AI_Canvas.png\n\nIn this image, I think the height in which the jellyfish is standing, this kind of jellyfish kind of artifact is standing is a bit too high. I want to make its height a bit more shorter, like the length of this wire or standing which is there standing. I want to reduce it like one by third of its current size, one by third of its current size, so it's in a bit more lower position, not too low, because we need to see that the wire or stuff in which they are standing is there. But this structure, this art piece, I want to make it a bit more lower, the height, so they are a bit more in the lower half, lower half, but not too low. But can you do that? No other changes, no other changes, only this. I only want to do this change.\n\nSO FOR DOING THIS WHAT IS THE PROMPT I SHOUDL BE GIVING TO NANO BANA PRO GIV EME THE PROPT TO GET THE THIS RESULT IF I GIVE THIS IAGE TO NANO BANA PRO ADN WANT THAT HANGE PROPRLY",
    "attachments": [],
    "ts": "2026-04-25T08:20:31Z"
  },
  {
    "pair": 2,
    "speaker": "ai",
    "text": "Viewed file\n\nRe-examining the jellyfish image to understand the height/structure to modify\n\nDone\n\nGot it. I can see exactly what you mean — the jellyfish bells are sitting at roughly mid-frame height, and you want to drop them down by ~1/3 of the tentacle/wire stand length, so the bells sit lower in the frame but the wire stands are still clearly visible above the water reflection.\n\nHere's the Nano Banana Pro prompt for that surgical edit:\n\n🍌 NANO BANANA PRO — Edit Prompt\n\nUsing the provided image as the base, lower the vertical position of all four jellyfish sculpture bells (the glowing teal-blue dome-shaped tops) by approximately one-third of the length of their wire/tentacle stands. The bells should now sit in the lower half of the frame, but not too low — keep the wire stand structures clearly visible above the water reflection so the supporting tentacle wires are still seen. Shorten the height of the entire sculpture installation accordingly.\n\nPRESERVE EXACTLY (do not change):\n- The number of jellyfish (4) and their horizontal positions\n- The shape, color, and bioluminescent glow of each bell\n- The wire/tentacle stand design and material\n- The stone columns, brick arches, and entire architectural background\n- The water surface, reflections, and ambient warm amber lighting\n- The camera angle, framing, aspect ratio, and overall composition\n- The color grade and atmosphere\n\nOnly change: the vertical height of the sculptures so the bells sit lower in the frame.\n\nWhy this prompt is structured this way\n\nConcrete proportional reference — \"one-third of the length of their wire/tentacle stands\" gives Nano Banana a measurable target instead of vague \"a bit lower,\" which it tends to under-execute or over-execute wildly.\n\nExplicit lower-bound guard — \"not too low\" + \"keep the wire stand structures clearly visible above the water reflection\" prevents it from dropping the bells underwater or making the wires disappear, which is the most common failure mode for \"lower the position\" edits.\n\nHard preserve list — Nano Banana Pro is notorious for sneaking in compositional changes when you ask for a single edit. The explicit \"PRESERVE EXACTLY\" block fences off everything you don't want touched. The columns, water, and color grade are specifically called out because those are the elements most likely to drift.\n\nSingle-change directive at the end — restating \"Only change: ...\" at the bottom acts as a final anchor. Nano Banana weights the last instruction heavily.\n\nIf first output is wrong\n\nBells dropped too far / underwater → change \"one-third\" to \"about 25%\" and add \"the bells must remain well above the water surface\"\n\nWires got shorter instead of bells lowering → change to: \"Keep the wire/tentacle stands at their full original length. Move the entire sculpture downward as a single unit so the bells sit lower in the frame\"\n\nBackground changed → re-run with the same prompt but add at the top: \"This is a position-only edit. The background is locked.\"",
    "attachments": [],
    "ts": "2026-04-25T08:20:59Z"
  }
]
